{
  "programTitle": "Promptų anatomija",
  "certificateLabel": "SERTIFIKATAS",
  "authorBy": "Tomas Staniulis",
  "authorProduct": "Promptų anatomija",
  "authorByLabel": "Autorius:",
  "authorProductLabel": "Programa ir metodika:",
  "serialLabel": "Sertifikato Nr.",
  "websiteUrl": "https://www.promptanatomy.app/",
  "websiteCta": "Kursas ir daugiau: promptanatomy.app",
  "tiers": [
    {
      "tier": 1,
      "introLine": "Šiuo dokumentu patvirtinama, kad",
      "completionLine": "sėkmingai baigė 6 blokų sistemą",
      "programName": "Išmoko struktūruoti DI užduotį pagal 6 blokus.",
      "label": "6 blokų sistema",
      "footerText": "Promptų anatomija. © Kurso medžiaga."
    },
    {
      "tier": 2,
      "introLine": "Šiuo dokumentu patvirtinama, kad",
      "completionLine": "sėkmingai baigė Konteksto inžineriją",
      "programName": "Išmoko parinkti ir valdyti DI kontekstą.",
      "label": "Konteksto inžinerija",
      "footerText": "Promptų anatomija. © Kurso medžiaga."
    },
    {
      "tier": 3,
      "introLine": "Šiuo dokumentu patvirtinama, kad",
      "completionLine": "sėkmingai baigė Duomenų analizės kelią",
      "programName": "Išmoko analizuoti duomenis su DI ir tikrinti išvadas.",
      "label": "Duomenų analizės kelias",
      "footerText": "Promptų anatomija. © Kurso medžiaga."
    },
    {
      "tier": 4,
      "introLine": "Šiuo dokumentu patvirtinama, kad",
      "completionLine": "sėkmingai baigė Agentų inžinerijos kelią",
      "programName": "Išmoko projektuoti agento eigą, įrankius ir kontrolę.",
      "label": "Agentų inžinerijos kelias",
      "footerText": "Promptų anatomija. © Kurso medžiaga."
    },
    {
      "tier": 5,
      "introLine": "Šiuo dokumentu patvirtinama, kad",
      "completionLine": "sėkmingai baigė Turinio inžinerijos kelią",
      "programName": "Išmoko kurti tekstą, vaizdą, video ir garsą.",
      "label": "Turinio inžinerijos kelias",
      "footerText": "Promptų anatomija. © Kurso medžiaga."
    }
  ]
}
